IL17RC_1;0,148147;chr3:IL17RC:NM_001367279:exon9:c.A800G:p.Q267R,IL17RC:NM_001203265:exon10:c.A875G:p.Q292R,IL17RC:NM_001367280:exon10:c.A875G:p.Q292R,IL17RC:NM_032732:exon10:c.A875G:p.Q292R,IL17RC:NM_001203263:exon11:c.A920G:p.Q307R,IL17RC:NM_001203264:exon11:c.A920G:p.Q307R,IL17RC:NM_001367278:exon11:c.A881G:p.Q294R,IL17RC:NM_153460:exon11:c.A920G:p.Q307R,IL17RC:NM_153461:exon11:c.A1133G:p.Q378R;903;severity;IL17 receptor: Major effector cytokines of innate and adaptive immune system involved in antimicrobial host defense and maintenance of tissue integrity;not known;IL-17–Induced Pulmonary Pathogenesis during Respiratory Viral Infection and Exacerbation of Allergic Disease;https://www.ncbi.nlm.nih.gov/pmc/articles/PMC3123803/;;Common Homozygous
TIGD4_1;0,124131;chr4:TIGD4:NM_145720:exon2:c.A1315G:p.I439V;466;severity;These proteins are related to DNA transposons found in fungi and nematodes;not known;not known;none;;Common Homozygous
RBM11_1;-0,10306;chr21:RBM11:NM_001320602:exon4:c.T346G:p.L116V,RBM11:NM_144770:exon4:c.T346G:p.L116V;787;Protection;Tissue-specific splicing factor with potential implication in the regulation of alternative splicing during neuron and germ cell differentiation;not known;not known;none;;Common Homozygous
SPATA5L1_1;0,093945;chr15:SPATA5L1:NM_001323640:exon1:c.G755A:p.R252Q,SPATA5L1:NM_024063:exon1:c.G755A:p.R252Q;165;severity;Involved in morphological and functional mitochondrial transformations during spermatogenesis;not known;Genome-wide pooling approach identifies SPATA5 as a new susceptibility locus for alopecia areata.;https://pubmed.ncbi.nlm.nih.gov/22027810/;;Common Homozygous
POLI_1;-0,07534;chr18:POLI:NM_001351610:exon1:c.42_44del:p.D17del,POLI:NM_001351613:exon1:c.42_44del:p.D17del,POLI:NM_001351616:exon1:c.42_44del:p.D17del,POLI:NM_001351621:exon1:c.42_44del:p.D17del,POLI:NM_007195:exon1:c.42_44del:p.D17del_chr18:POLI:NM_001351616:exon8:c.G1828A:p.A610T,POLI:NM_001351610:exon9:c.G2065A:p.A689T,POLI:NM_001351613:exon9:c.G1954A:p.A652T,POLI:NM_001351614:exon9:c.G1882A:p.A628T,POLI:NM_001351615:exon9:c.G1882A:p.A628T,POLI:NM_001351617:exon9:c.G1648A:p.A550T,POLI:NM_001351620:exon9:c.G1411A:p.A471T,POLI:NM_001351611:exon10:c.G1987A:p.A663T,POLI:NM_001351612:exon10:c.G1987A:p.A663T,POLI:NM_001351618:exon10:c.G1648A:p.A550T,POLI:NM_001351619:exon10:c.G1648A:p.A550T,POLI:NM_001351632:exon10:c.G2116A:p.A706T,POLI:NM_007195:exon10:c.G2191A:p.A731T;682;Protection;An error-prone DNA polymerase involved in DNA repair;not known;not known;none;;Common Homozygous
CFHR1_1;-0,07233;chr1:CFHR1:NM_002113:exon4:c.C475G:p.L159V;378;Protection;This gene encodes a secreted protein belonging to the complement factor H protein family.;not known;It binds to Pseudomonas aeruginosa elongation factor Tuf together with plasminogen. It is proposed that Tuf acts as a virulence factor by acquiring host proteins to the pathogen surface, controlling complement, and facilitating tissue invasion.;"Kraivong R, Vasanawathana S, Limpitikul W, et al. Complement alternative pathway genetic variation and Dengue infection in the Thai population. Clin Exp Immunol. 2013;174(2):326-334. doi:10.1111/cei.12184";;Common Homozygous
CFHR4_1;-0,0708;chr1:CFHR4:NM_001201550:exon3:c.G375T:p.E125D,CFHR4:NM_001201551:exon3:c.G372T:p.E124D;763;Protection;Involved in complement regulation. Can associate with lipoproteins and may play a role in lipid metabolism.;its related pathways are Complement and coagulation cascades. Gene Ontology (GO) annotations related to this gene include lipid transporter activity;Diseases associated with CFHR4 include Hemolytic Uremic Syndrome, Atypical 1 and Hemolytic-Uremic Syndrome.;none;;Common Homozygous
FASTKD3_1;0,068913;chr5:FASTKD3:NM_024091:exon2:c.A167G:p.K56R;822;severity;Required for normal mitochondrial respiration;not known;not known;none;;Common Homozygous
MCAT_1;0,0645;chr22:MCAT:NM_173467:exon4:c.C908G:p.A303G;486;severity;It catalyzes the transfer of a malonyl moiety from malonyl-CoA to the free thiol group of the phosphopantetheine arm of the mitochondrial ACP protein;Among its related pathways are Fatty acid biosynthesis (KEGG) and Metabolism. Gene Ontology (GO) annotations related to this gene include [acyl-carrier-protein] S-malonyltransferase activity.;not known;none;;Common Homozygous
CD52_1;0,063434;chr1:CD52:NM_001803:exon2:c.A119G:p.N40S_chr1:CD52:NM_001803:exon2:c.A123G:p.I41M;719;severity;CD52 is a peptide of 12 amino acids, anchored to glycosylphosphatidylinositol (GPI). Since it is highly negatively charged and present on sperm cells and lymphocytes, it has been conjectured that its function is anti-adhesion, allowing cells to freely move around.;Among its related pathways are Metabolism of proteins and Post-translational modification- synthesis of GPI-anchored proteins.;CD52 is a surface molecule modulated by HIV;https://www.researchgate.net/publication/320458791_CD52_expression_on_CD4_T_cells_in_HIV-positive_individuals_on_cART;;Common Homozygous
EPCAM_1;0,056853;chr2:EPCAM:NM_002354:exon3:c.T344C:p.M115T;218;severity;This gene encodes a carcinoma-associated antigen and is a member of a family that includes at least two type I membrane proteins. This antigen is expressed on most normal epithelial cells and gastrointestinal carcinomas and functions as a homotypic calcium-independent cell adhesion molecule. The antigen is being used as a target for immunotherapy treatment of human carcinomas. Mutations in this gene result in congenital tufting enteropathy.;Among its related pathways are Cell surface interactions at the vascular wall and Response to elevated platelet cytosolic Ca2+;functional significance of EpCAM re-expression in HBV-mediated hepatocarcinogenesis.;https://pubmed.ncbi.nlm.nih.gov/27238755/;;Common Homozygous
APOBEC1_1;-0,055;chr12:APOBEC1:NM_005889:exon2:c.G105C:p.M35I,APOBEC1:NM_001644:exon3:c.G240C:p.M80I,APOBEC1:NM_001304566:exon4:c.G240C:p.M80I;1094;Protection;This gene encodes a member of the cytidine deaminase enzyme family. The encoded protein forms a multiple-protein editing holoenzyme with APOBEC1 complementation factor (ACF) and APOBEC1 stimulating protein (ASP).;Among its related pathways are Gene Expression and mRNA Editing- C to U Conversion. Gene Ontology (GO) annotations related to this gene include RNA binding and hydrolase activity, acting on carbon-nitrogen (but not peptide) bonds, in cyclic amidines.;"Human APOBEC3G (hA3G) is a member of the APOBEC-1 related protein (ARP) family of cytidine deaminases. hA3G functions as a natural defense against endogenous retrotransposons and a multitude of retroviruses, most notably human immunodeficiency virus type 1 (HIV-1). RNA editing by host deaminases for instance is an innate restriction process to
counter virus infection. Recent work revealed evidence for host-dependent RNA editing in
SARS-CoV-2. Consistent with these reports we find the APOBEC1 complementation factor
(A1CF) among the most significantly enriched SARS-CoV-2 interactors.";"Giorgio, S. D., Martignano, F., Torcia, M. G., Mattiuz, G. & Conticello, S. G. Evidence for host-dependent RNA editing in the transcriptome of SARS-CoV-2. Sci Adv 6, eabb5813 (2020). Bennett, Ryan P., et al. ""APOBEC-1 and AID are nucleo-cytoplasmic trafficking proteins but APOBEC3G cannot traffic."" Biochemical and biophysical research communications 350.1 (2006): 214-219.";;Common Homozygous
CCDC61_1;0,054227;chr19:CCDC61:NM_001267723:exon10:c.A1166G:p.Q389R;714;severity;Function is not known;not known;not known;none;;Common Homozygous
RALY_1;0,05347;chr20:RALY:NM_007367:exon7:c.641_642insCAG:p.A214_G215insS,RALY:NM_016732:exon8:c.689_690insCAG:p.A230_G231insS;695;severity;The encoded protein plays a role in pre-mRNA splicing.;not known;Knockdown of RALY and hnRNP-C increased levels of viral RNA splicing, protein abundance, and progeny production during infection with E1B55K47 deleted virus. Furthermore, infection with virus deleted for E1B55K resulted in increased interaction of hnRNP-C with viral RNA, and attenuation of viral RNA processing. These data suggest viral-mediated ubiquitination of RALY and hnRNP-C relieves a restriction on viral RNA processing, revealing an unexpected role for non-degradative ubiquitination in manipulation of cellular processes during virus infection.;"Herrmann, Christin, et al. ""Viral-mediated ubiquitination impacts interactions of host proteins with viral RNA and promotes viral RNA processing."" bioRxiv (2020).";;Common Homozygous
A2ML1_2;0,041013;chr12:A2ML1:NM_001282424:exon9:c.C1077A:p.D359E,A2ML1:NM_144670:exon20:c.C2550A:p.D850E_chr12:A2ML1:NM_001282424:exon18:c.A2213G:p.H738R,A2ML1:NM_144670:exon29:c.A3686G:p.H1229R_chr12:A2ML1:NM_001282424:exon19:c.A2296G:p.M766V,A2ML1:NM_144670:exon30:c.A3769G:p.M1257V;678;severity;This gene encodes a member of the alpha-macroglobulin superfamily. The encoded protein is thought to be an N-glycosylated monomeric protein that acts as an inhibitor of several proteases.;serine-type endopeptidase inhibitor activity and peptidase inhibitor activity;not known;none;;Common Homozygous
ZNF749_1;0,038556;chr19:ZNF749:NM_001321953:exon2:c.T2051G:p.I684R,ZNF749:NM_001321954:exon2:c.T2051G:p.I684R,ZNF749:NM_001023561:exon3:c.T2312G:p.I771R,ZNF749:NM_001321952:exon3:c.T2291G:p.I764R;422;severity;ZNF749 (Zinc Finger Protein 749) is a Protein Coding gene. Among its related pathways are Gene Expression and Herpes simplex virus 1 infection.;not known;not known;none;;Common Homozygous
TMEM159_1;0,034935;chr16:TMEM159:NM_001301771:exon5:c.A462C:p.E154D,TMEM159:NM_020422:exon5:c.A462C:p.E154D,TMEM159:NM_001301769:exon6:c.A462C:p.E154D,TMEM159:NM_001301775:exon6:c.A534C:p.E178D;737;severity;Plays an important role in the formation of lipid droplets (LD) which are storage organelles at the center of lipid and energy homeostasis (PubMed:31708432). In association with BSCL2/seipin, defines the sites of LD formation in the endoplasmic reticulum;not known;not known;none;;Common Homozygous
NBPF3_1;-0,0317;chr1:NBPF3:NM_001256416:exon3:c.A341G:p.Y114C,NBPF3:NM_032264:exon3:c.A341G:p.Y114C,NBPF3:NM_001330381:exon7:c.A173G:p.Y58C;425;Protection;This gene is a member of the neuroblastoma breakpoint family (NBPF) which consists of dozens of recently duplicated genes primarily located in segmental duplications on human chromosome 1.;not known;not known;none;;Common Homozygous
CILP_3;0,029441;chr15:CILP:NM_003613:exon9:c.G3496A:p.G1166S_chr15:CILP:NM_003613:exon9:c.A2936G:p.Q979R_chr15:CILP:NM_003613:exon9:c.A1723G:p.K575E;638;severity;Probably plays a role in cartilage scaffolding. May act by antagonizing TGF-beta1 (TGFB1) and IGF1 functions.;Among its related pathways are Signaling by GPCR and RET signaling. Gene Ontology (GO) annotations related to this gene include alkaline phosphatase activity and nucleotide diphosphatase activity;not known;none;;Common Homozygous
FGF21_1;0,029023;chr19:FGF21:NM_019113:exon4:c.T521C:p.L174P;637;severity;Theis gene encodes a member of the fibroblast growth factor (FGF) family. FGF family members possess broad mitogenic and cell survival activities and are involved in a variety of biological processes.;not known;not known;none;;Common Homozygous
USP44_1;0,027266;chr12:USP44:NM_001042403:exon2:c.A271G:p.T91A,USP44:NM_001278393:exon2:c.A271G:p.T91A,USP44:NM_001347937:exon2:c.A271G:p.T91A,USP44:NM_032147:exon2:c.A271G:p.T91A,USP44:NM_001347936:exon3:c.A271G:p.T91A;388;severity;The protein encoded by this gene is a protease that functions as a deubiquitinating enzyme. The encoded protein is thought to help regulate the spindle assembly checkpoint by preventing early anaphase onset.;not known;Deubiquitinating enzymes USP44 associates with MITA and removes the K48-linked polyubiquitin chains from MITA, therefore maintains the stability of MITA after DNA virus infection. Deficiency of USP44 results in accelerated degradation of MITA, impaired induction of type I IFNs and proinflammatory cytokines, and increased viral replication. These findings suggest that USP44 is a positive regulator of MITA and plays an important role in the regulation of innate immune response against DNA viruses.;"Zhang, Hong-Yan, et al. ""USP44 positively regulates innate immune response to DNA viruses through deubiquitinating MITA."" PLoS Pathogens 16.1 (2020): e1008178.";;Common Homozygous
COL6A3_3;-0,0265;chr2:COL6A3:NM_057166:exon38:c.C7385T:p.T2462I,COL6A3:NM_057167:exon40:c.C8588T:p.T2863I,COL6A3:NM_004369:exon41:c.C9206T:p.T3069I_chr2:COL6A3:NM_057166:exon38:c.G7213C:p.A2405P,COL6A3:NM_057167:exon40:c.G8416C:p.A2806P,COL6A3:NM_004369:exon41:c.G9034C:p.A3012P_chr2:COL6A3:NM_057166:exon37:c.T6959C:p.M2320T,COL6A3:NM_057167:exon39:c.T8162C:p.M2721T,COL6A3:NM_004369:exon40:c.T8780C:p.M2927T;246;Protection;COL6A3 (Collagen Type VI Alpha 3 Chain) is a Protein Coding gene. Diseases associated with COL6A3 include Bethlem Myopathy 1 and Dystonia 27. Among its related pathways are Integrin Pathway and Collagen chain trimerization.;Among its related pathways are Integrin Pathway and Collagen chain trimerization. Gene Ontology (GO) annotations related to this gene include serine-type endopeptidase inhibitor activity.;not known;none;;Common Homozygous
FAM184B_2;-0,02395;chr4:FAM184B:NM_015688:exon18:c.T3125C:p.V1042A_chr4:FAM184B:NM_015688:exon13:c.C2350T:p.R784W_chr4:FAM184B:NM_015688:exon10:c.G1928A:p.R643H;499;Protection;FAM184B (Family With Sequence Similarity 184 Member B) is a Protein Coding gene.;not known;not known;none;;Common Homozygous
MTRR_2;0,015549;chr5:MTRR:NM_001364440:exon2:c.A66G:p.I22M,MTRR:NM_001364441:exon2:c.A66G:p.I22M,MTRR:NM_001364442:exon2:c.A66G:p.I22M,MTRR:NM_002454:exon2:c.A66G:p.I22M,MTRR:NM_024010:exon2:c.A66G:p.I22M;230;severity;Key enzyme in methionine and folate homeostasis responsible for the reactivation of methionine synthase (MTR/MS) activity by catalyzing the reductive methylation of MTR-bound cob(II)alamin;Among its related pathways are Folate Metabolism and Cytochrome P450 - arranged by substrate type. Gene Ontology (GO) annotations related to this gene include oxidoreductase activity and flavin adenine dinucleotide binding.;not known;none;;Common Homozygous
CHPT1_1;-0,01345;chr12:CHPT1:NM_020244:exon3:c.T485C:p.F162S;140;Protection;Catalyzes phosphatidylcholine biosynthesis from CDP-choline. It thereby plays a central role in the formation and maintenance of vesicular membranes.;Among its related pathways are Phospholipase D signaling pathway and Glycerophospholipid biosynthesis. Gene Ontology (GO) annotations related to this gene include diacylglycerol binding and diacylglycerol cholinephosphotransferase activity.;not known;none;;Common Homozygous
DISP3_1;0,012098;chr1:DISP3:NM_020780:exon2:c.G544A:p.G182S_chr1:DISP3:NM_020780:exon8:c.G1948A:p.A650T;425;severity;Plays a role in neuronal proliferation and differentiation (PubMed:25281927). Plays a role in the accumulation of cellular cholesterol (By similarity). Involved in intracellular lipid droplet formation.;not known;not known;none;;Common Homozygous
MTHFD1_1;0,012073;chr14:MTHFD1:NM_001364837:exon6:c.A401G:p.K134R,MTHFD1:NM_005956:exon6:c.A401G:p.K134R;802;severity;MTHFD1 (Methylenetetrahydrofolate Dehydrogenase, Cyclohydrolase And Formyltetrahydrofolate Synthetase 1) is a Protein Coding gene. Among its related pathways are One carbon pool by folate and Folate Metabolism.;Among its related pathways are One carbon pool by folate and Folate Metabolism. Gene Ontology (GO) annotations related to this gene include formate-tetrahydrofolate ligase activity and methylenetetrahydrofolate dehydrogenase (NADP+) activity.;general dependence of the C-1-tetrahydrofolate synthase gene, MTHFD1, for viral replication in bat cells as well as in human cells. MTHFD1 inhibitor carolacton potently blocked replication of several RNA viruses including SARS-CoV-2.;https://www.biorxiv.org/content/10.1101/2020.03.29.014209v1.full.pdf;;Common Homozygous
COQ7_1;-0,01079;chr16:COQ7:NM_001190983:exon3:c.C194T:p.T65M,COQ7:NM_001370489:exon3:c.C266T:p.T89M,COQ7:NM_001370490:exon3:c.C308T:p.T103M,COQ7:NM_001370491:exon3:c.C266T:p.T89M,COQ7:NM_001370492:exon3:c.C194T:p.T65M,COQ7:NM_001370493:exon3:c.C194T:p.T65M,COQ7:NM_001370494:exon3:c.C194T:p.T65M,COQ7:NM_001370495:exon3:c.C194T:p.T65M,COQ7:NM_016138:exon3:c.C308T:p.T103M;617;Protection;Catalyzes the hydroxylation of 2-polyprenyl-3-methyl-6-methoxy-1,4-benzoquinol (DMQH2) during ubiquinone biosynthesis. Has also a structural role in the COQ enzyme complex, stabilizing other COQ polypeptides. Involved in lifespan determination in a ubiquinone-independent manner.;Among its related pathways are Metabolism and Ubiquinol biosynthesis.;none;none;;Common Homozygous
RMI1_1;0,006469;chr9:RMI1:NM_001358291:exon3:c.A1364G:p.N455S,RMI1:NM_001358294:exon3:c.A1364G:p.N455S,RMI1:NM_024945:exon3:c.A1364G:p.N455S,RMI1:NM_001358292:exon4:c.A1364G:p.N455S,RMI1:NM_001358293:exon4:c.A1364G:p.N455S;636;severity;Essential component of the RMI complex, a complex that plays an important role in the processing of homologous recombination intermediates to limit DNA crossover formation in cells.;Among its related pathways are Homologous DNA Pairing and Strand Exchange and Regulation of TP53 Activity.;none;none;;Common Homozygous
PRSS55_1;0,006406;chr8:PRSS55:NM_001197020:exon1:c.C131G:p.P44R,PRSS55:NM_198464:exon1:c.C131G:p.P44R;711;severity;This gene encodes a member of a group of membrane-anchored chymotrypsin (S1)-like serine proteases. The enocoded protein is primarily expressed in the Leydig and Sertoli cells of the testis and may be involved in male fertility.;Gene Ontology (GO) annotations related to this gene include serine-type endopeptidase activity;none;none;;Common Homozygous
RHBDF2_1;-0,00628;chr17:RHBDF2:NM_001005498:exon5:c.C536T:p.P179L,RHBDF2:NM_024599:exon6:c.C623T:p.P208L;884;Protection;This gene encodes a member of a group of membrane-anchored chymotrypsin (S1)-like serine proteases. The enocoded protein is primarily expressed in the Leydig and Sertoli cells of the testis and may be involved in male fertility.;Gene Ontology (GO) annotations related to this gene include serine-type endopeptidase activity and growth factor binding.;none;none;;Common Homozygous
TXNRD1_1;0,004106;chr12:UNKNOWN_chr12:UNKNOWN;861;severity;"
This gene encodes a protein, which plays a key role in redox homoeostasis";TR1 targets the disulfide bonds in Tat, is an HIV-encoded transactivating protein that is required for virus replication, and acts as a negative regulator of Tat-dependent proviral transcription;TXNRD1 encodes transcriptional activator Tat, whixh negatively regulates the activity of the HIV-1, in human macrophages;"Kalantari P, Narayan V, Natarajan SK, et al. Thioredoxin reductase-1 negatively regulates HIV-1 transactivating protein Tat-dependent transcription in human macrophages. J Biol Chem. 2008;283(48):33183-33190. doi:10.1074/jbc.M807403200";;Common Homozygous
TP53_1;0,003358;chr17:TP53:NM_001126118:exon3:c.C98G:p.P33R,TP53:NM_000546:exon4:c.C215G:p.P72R,TP53:NM_001126112:exon4:c.C215G:p.P72R,TP53:NM_001126113:exon4:c.C215G:p.P72R,TP53:NM_001126114:exon4:c.C215G:p.P72R,TP53:NM_001276695:exon4:c.C98G:p.P33R,TP53:NM_001276696:exon4:c.C98G:p.P33R,TP53:NM_001276760:exon4:c.C98G:p.P33R,TP53:NM_001276761:exon4:c.C98G:p.P33R;707;severity;"Acts as a tumor suppressor in many tumor types; induces growth arrest or apoptosis depending on the physiological circumstances and cell type. Involved in cell cycle regulation as a trans-activator that acts to negatively regulate cell division by controlling a set of genes required for this process. One of the activated genes is an inhibitor of cyclin-dependent kinases.";In normal cells, the p53 protein level is low. DNA damage and other stress signals may trigger the increase of p53 proteins, which have three major functions: growth arrest, DNA repair and apoptosis (cell death). The growth arrest stops the progression of cell cycle, preventing replication of damaged DNA.;It seems that IAV hijacks p53 by causing its activation, leading to enhanced apoptosis and thus IAV viral replication. However, ample data suggest that p53 also acts as a host antiviral factor that enhances innate and adaptive immune responses in order to battle the infection.;p53 and the Viral Connection: Back into the Future - NCBI - NIH;;Common Homozygous
CAPN15_rare_AD;-0,634703;protection;This gene encodes a protein containing zinc-finger-like repeats and a calpain-like protease domain. The encoded protein may function as a transcription factor, RNA-binding protein, or in protein-protein interactions during visual system development.;none;none;none;;;;rare_AD
CASKIN1_rare_AD;-0,440388;protection;"Calcium/calmodulin-dependent serine protein kinase (CASK)-interacting protein 1 (Caskin1) is a direct binding partner of the synaptic adaptor protein CASK. Because Caskin1 forms homo-multimers and binds not only CASK but also other neuronal proteins in vitro, it is anticipated to have neural functions; but its exact role in mammals remains unclear.";none;Enrichment of miR-21a-5p increases PHEV (Porcine hemagglutinating encephalomyelitis virus is a typical neurotropic coronavirus) proliferation by targeting the protein Caskin1, which is required for neuronal axon growth in vivo and in vitro.;Lv XL, Zhao K, Lan YG, Li Z, Ding N, Su JJ, Lu HJ, Song DG, Gao F, He WQ (2017) miR-21a-5p contributes to porcine hemagglutinating encephalomyelitis virus proliferation via targeting CASK-interactive protein1 in vivo and vitro. Front Microbiol 8:304;;;;rare_AD
GRM6_rare_AD;-0,352224;protection;L-glutamate is the major excitatory neurotransmitter in the central nervous system and activates both ionotropic and metabotropic glutamate receptors. Glutamatergic neurotransmission is involved in most aspects of normal brain function and can be perturbed in many neuropathologic conditions.;none;none;none;;;;rare_AD
APBA3_rare_AD;0,343117;severity;Amyloid Beta Precursor Protein Binding Family A Member 3, interacts with the Alzheimer's disease amyloid precursor protein. APBA3). APBA3is a member of the Mint protein family, which has a potential role in antiviral immune responses.;The protein interacts with TRAF3 and enhances IRF3 activation and IFN-β secretion;"During viral infection APBA3 expression increases in macrophages. It increases TLR3/4- and RIG-I–induced IRF3 activation. APBA3 inhibition might represent one of the likely targets for the treatment of severe influenza pneumonia.
APBA3 depletion in mice attenuated fatal influenza pneumonia, reducing inflammatory cytokine/chemokine production in response to influenza virus infection by inactiving HIF-1.";"Mint3 potentiates TLR3/4- and RIG-I–induced IFN-β expression and antiviral immune responses. Wanwan Huai, Hui Song, Zhongxia Yu, Wenwen Wang, Lihui Han, Takeharu Sakamoto, Motoharu Seiki, Lining Zhang, Qunye Zhang, and Wei Zhao PNAS October 18, 2016 113 (42) 11925-11930; first published October 3, 2016.
Uematsu, T., Fujita, T., Nakaoka, H. et al. Mint3/Apba3 depletion ameliorates severe murine influenza pneumonia and macrophage cytokine production in response to the influenza virus. Sci Rep 6, 37815 (2016). https://doi.org/10.1038/srep37815";;;;rare_AD
BLK_rare_AD;0,295533;severity;This gene encodes a nonreceptor tyrosine-kinase of the src family of proto-oncogenes that are typically involved in cell proliferation and differentiation. The protein has a role in B-cell receptor signaling and B-cell development. B-cell receptor (BCR) signaling requires a tight regulation of several protein tyrosine kinases and phosphatases, and associated coreceptors (By similarity). Binding of antigen to the B-cell antigen receptor (BCR) triggers signaling that ultimately leads to B-cell activation;none;none;none;;;;rare_AD
LRP8_rare_AD;0,292496;severity;The gene encodes a member of the low density lipoprotein receptor (LDLR) family. Low density lipoprotein receptors are cell surface proteins that play roles in both signal transduction and receptor-mediated endocytosis of specific ligands for lysosomal degradation. Together with its ligand, apolipoprotein E (apoE), may indirectly play a role in the suppression of the innate immune response by controlling the survival of myeloid-derived suppressor cells (By similarity).;none;none;none;;;;rare_AD
ZC3H3_rare_AD;0,276845;severity;ZC3H3 (Zinc Finger CCCH-Type Containing 3) is a Protein Coding gene. Required for the export of polyadenylated mRNAs from the nucleus (PubMed:19364924). Enhances ACVR1B-induced SMAD-dependent transcription. Binds to single-stranded DNA but not to double-stranded DNA in vitro. Involved in RNA cleavage;none;none;none;;;;rare_AD
AKAP17A_rare_AD;0,247594;severity;This locus encodes a protein kinase A anchoring protein. The encoded protein is part of the spliceosome complex and is involved in the regulation of alternate splicing in some mRNA precursors.;none;none;none;;;;rare_AD
PLEKHG4_rare_AD;0,223547;severity;The protein encoded by this gene can function as a guanine nucleotide exchange factor (GEF) and may play a role in intracellular signaling and cytoskeleton dynamics at the Golgi apparatus.;none;none;none;;;;rare_AD
EXPH5_rare_AD;0,209548;severity;The protein encoded by this gene is a member of the synaptotagmin-like protein (Slp) family lacking a C2 domain. This protein is thought to be involved in exosome secretion and intracellular vesicle trafficking. Reduced expression of this gene results in keratin filament defects.;none;none;none;;;;rare_AD
